<?xml version="1.0"?>
<!-- <root xmlns:xsi="http://www.w3.org/2001/XMLSchema-instance" xsi:schemaLocation="11_st.xsd"> -->
<students xmlns:xsi="http://www.w3.org/2001/XMLSchema-instance" xsi:schemaLocation="11_st.xsd">
	<student>
		<rollnumber>95A0</rollnumber>
		<name>aaa</name>
		<marks>500</marks>
		<result>Firstclass</result>
	</student>
	<student>
		<rollnumber>95A1</rollnumber>
		<name>bbb</name>
		<marks>450</marks>
		<result>Firstclass</result>
	</student>
</students>
<!-- </root> -->